Chợ Quán	53	Phường	63545	1.28	49644.53	Phường 1 (Quận 5), Phường 2 (Quận 5), Phường 4 (Quận 5)		phường An Đông, phường Cầu Ông Lãnh, phường Vườn Lài, phường Chánh Hưng, phường Vĩnh Hội và phường Bàn Cờ		số 462 - 464 - 466 An Dương Vương, phường 4, quận 5	 số 462 - 464 - 466 An Dương Vương, phường 4, quận 5 	10.7587371	106.6765588			  			xây mới
Côn Đảo	54	Đặc khu	6502	75.79	85.79	Định hướng chuyển thành đặc khu từ toàn bộ Huyện Côn Đảo		không	UBND huyện Côn Đảo	28 Tôn Đức Thắng, huyện Côn Đảo	UBND huyện Côn Đảo 28 Tôn Đức Thắng, huyện Côn Đảo 	8.682211	106.6072676			  			
Củ Chi	55	Xã	128661	64.88	1983.06	Xã Tân Phú Trung (H. Củ Chi), Xã Tân Thông Hội (H. Củ Chi), Xã Phước Vĩnh An (H. Củ Chi)		xã Tân An Hội, xã Nhuận Đức, xã Phú Hoà Đông, xã Hóc Môn, xã Xuân Thới Sơn và tỉnh Tây Ninh	UBND xã Tân Phú Trung	số 314 Phan Văn Khải (quốc lộ 22), xã Tân Phú Trung, huyện Củ Chi	UBND xã Tân Phú Trung số 314 Phan Văn Khải (quốc lộ 22), xã Tân Phú Trung, huyện Củ Chi 	10.9399106	106.5395242			  			
Đất Đỏ	56	Xã	43862	119.77	366.23	Thị trấn Đất Đỏ, Xã Láng Dài, Xã Long Tân, Xã Phước Long Thọ (H. Long Đất)		phường Tam Long, xã Long Điền, xã Phước Hải, xã Hồ Tràm, xã Xuân Sơn và xã Nghĩa Thành	UBND huyện Long Đất	đường Võ Thị Sáu, khu phố Hòa Hội, thị trấn Đất Đỏ, huyện Long Đất	UBND huyện Long Đất đường Võ Thị Sáu, khu phố Hòa Hội, thị trấn Đất Đỏ, huyện Long Đất 	10.4785109	107.2160292			  			
Dầu Tiếng	57	Xã	39056	182.68	213.79	Thị trấn Dầu Tiếng, Xã Định An, Xã Định Thành (H. Dầu Tiếng)	Xã Định Hiệp (H. Dầu Tiếng)	xã Long Hoà, xã Thanh An, xã Minh Thạnh và tỉnh Tây Ninh	UBND huyện Dầu Tiếng	khu phố 4B, thị trấn Dầu Tiếng, huyện Dầu Tiếng	UBND huyện Dầu Tiếng khu phố 4B, thị trấn Dầu Tiếng, huyện Dầu Tiếng 	11.2942987	106.3675374			  			
Dĩ An	58	Phường	227817	21.38	10655.61	Phường Dĩ An (TP. Dĩ An), Phường An Bình (TP. Dĩ An)	Phường Tân Đông Hiệp (TP. Dĩ An)	phường Đông Hoà, phường Bình Hoà, phường An Phú, phường Tân Đông Hiệp, phường Linh Xuân, phường Tam Bình	UBND TP Dĩ An	số 10 trung tâm hành chính TP.Dĩ An cũ, TP.Dĩ An	UBND TP Dĩ An số 10 trung tâm hành chính TP.Dĩ An cũ, TP.Dĩ An 	10.8950935	106.765865			  			
Diên Hồng	59	Phường	75633	1.86	40662.9	Phường 6 (Quận 10), Phường 8 (Quận 10)	Phường 14 (Quận 10)	phường Hoà Hưng, phường Vườn Lài, phường An Đông, phường Chợ Lớn, phường Minh Phụng, phường Phú Thọ và phường Tân Hoà	UBND phường 14	số 1A Thành Thái, phường 14, quận 10	UBND phường 14 số 1A Thành Thái, phường 14, quận 10 	10.7745236	106.6649861			  			
Đông Hoà	60	Phường	132056	21.89	6033.62	Phường Bình An (TP. Dĩ An), Phường Bình Thắng (TP. Dĩ An), Phường Đông Hoà (TP. Dĩ An)		phường Dĩ An, phường Tân Đông Hiệp, phường Long Bình, phường Linh Xuân và tỉnh Đồng Nai	UBND phường Đông Hòa	số 201 đường ĐT743A, khu phố Bình Thung 2, phường Bình An, TP.Dĩ An	UBND phường Đông Hòa số 201 đường ĐT743A, khu phố Bình Thung 2, phường Bình An, TP.Dĩ An 	10.8986603	106.8088918			  			
Đông Hưng Thuận	61	Phường	182895	8.26	22142.25	Phường Tân Thới Nhất (Quận 12), Phường Tân Hưng Thuận (Quận 12), Phường Đông Hưng Thuận (Quận 12)		phường Trung Mỹ Tây, phường Tân Thới Hiệp, phường An Hội Tây, phường Tân Sơn, phường Bình Hưng Hoà, phường Tây Thạnh và xã Bà Điểm	UBND phường Tân Thới Nhất	số 68 Tân Thới Nhất 14, phường Tân Thới Nhất, quận 12	UBND phường Tân Thới Nhất số 68 Tân Thới Nhất 14, phường Tân Thới Nhất, quận 12 	10.8258709	106.6161443			  			
Đông Thạnh	62	Xã	190400	30.16	6312.99	Xã Đông Thạnh (H. Hóc Môn), Xã Nhị Bình (H. Hóc Môn), Xã Thới Tam Thôn (H. Hóc Môn)		Xã Bà Điểm, xã Hóc Môn, xã Bình Mỹ, phường Trung Mỹ Tây, phường Thới An, phường Tân Thới Hiệp, phường An Phú Đông, phường Thuận An và phường Lái Thiêu	UBND xã Đông Thạnh	số 250 Đặng Thúc Vịnh, ấp 7, xã Đông Thạnh, huyện Hóc Môn	UBND xã Đông Thạnh số 250 Đặng Thúc Vịnh, ấp 7, xã Đông Thạnh, huyện Hóc Môn 	10.9044927	106.6358119			  			
Đức Nhuận	63	Phường	71495	2.17	32946.99	Phường 4 (Quận Phú Nhuận), Phường 5 (Quận Phú Nhuận), Phường 9 (Quận Phú Nhuận)		phường Cầu Kiệu, phường Phú Nhuận, phường Tân Sơn Hoà, phường Hạnh Thông, phường Bình Lợi Trung và phường Gia Định	UBND phường 5	số 94 Phan Đăng Lưu, phường 5, quận Phú Nhuận	UBND phường 5 số 94 Phan Đăng Lưu, phường 5, quận Phú Nhuận 	10.809848	106.6835559			  			
Gia Định	64	Phường	125946	2.76	45632.61	Phường 1 (Quận Bình Thạnh), Phường 2 (Quận Bình Thạnh), Phường 7 (Quận Bình Thạnh), Phường 17 (Quận Bình Thạnh)		phường Thạnh Mỹ Tây, phường Bình Thạnh, phường Bình Lợi Trung, phường Sài Gòn, phường Tân Định, phường Đức Nhuận và phường Cầu Kiệu	Nhà thiếu nhi quận Bình Thạnh	số 134 Lê Văn Duyệt, phường 1, quận Bình Thạnh	Nhà thiếu nhi quận Bình Thạnh số 134 Lê Văn Duyệt, phường 1, quận Bình Thạnh 	10.7987261	106.6965007			  			
Gò Vấp	65	Phường	110850	2.81	39448.4	Phường 10 (Quận Gò Vấp), Phường 17 (Quận Gò Vấp)		phường Hạnh Thông, phường An Nhơn, phường Thông Tây Hội, phường An Hội Đông và phường Tân Sơn	UBND quận Gò Vấp	số 332 Quang Trung, phường 10, quận Gò Vấp	UBND quận Gò Vấp số 332 Quang Trung, phường 10, quận Gò Vấp 	10.8319219	106.669329			  			
Hạnh Thông	66	Phường	128865	3.37	38238.87	Phường 1 (Quận Gò Vấp), Phường 3 (Quận Gò Vấp)		phường An Nhơn, phường Bình Lợi Trung, phường Đức Nhuận, phường Xuân Hoà, phường Tân Sơn	UBND phường 3	số 23 Nguyễn Thái Sơn, phường 3, quận Gò Vấp	UBND phường 3 số 23 Nguyễn Thái Sơn, phường 3, quận Gò Vấp 	10.8203462	106.6827386			  			
Hiệp Bình	67	Phường	215638	16.01	13468.96	Phường Hiệp Bình Chánh (TP. Thủ Đức), Phường Hiệp Bình Phước (TP. Thủ Đức)	Phường Linh Đông (TP. Thủ Đức)	phường Tam Bình, phường Thủ Đức, phường Bình Quới, phường Bình Lợi Trung, phường An Phú Đông và phường Bình Hoà	UBND phường Hiệp Bình Chánh	số 2 đường số 5, phường Hiệp Bình Chánh, TP.Thủ Đức	UBND phường Hiệp Bình Chánh số 2 đường số 5, phường Hiệp Bình Chánh, TP.Thủ Đức 	10.8295724	106.7133757			  			
Hiệp Phước	68	Xã	67754	63.33	1069.86	Xã Nhơn Đức (H. Nhà Bè), Xã Long Thới (H. Nhà Bè), Xã Hiệp Phước (H. Nhà Bè)		xã Nhà Bè, xã Hưng Long, xã Bình Khánh, xã An Thới Đông và tỉnh Tây Ninh	UBND xã Long Thới	số 209 Nguyễn Văn Tạo, xã Long Thới, huyện Nhà Bè	UBND xã Long Thới số 209 Nguyễn Văn Tạo, xã Long Thới, huyện Nhà Bè 	10.6562443	106.7290045			  			
Hồ Tràm	69	Xã	51895	94.51	549.09	Thị trấn Phước Bửu, Xã Phước Tân, Xã Phước Thuận (H. Xuyên Mộc)		xã Phước Hải, xã Đất Đỏ, xã Xuân Sơn, xã Hoà Hội, xã Xuyên Mộc và Biển Đông	UBND huyện Xuyên Mộc	quốc lộ 55, thị trấn Phước Bửu, huyện Xuyên Mộc	UBND huyện Xuyên Mộc quốc lộ 55, thị trấn Phước Bửu, huyện Xuyên Mộc 	10.5379094	107.4063143			  			
Hoà Bình	70	Phường	69318	0.98	70732.65	Phường 5 (Quận 11), Phường 14 (Quận 11)		phường Bình Thới, phường Phú Thọ, phường Tân Phú, phường Tân Hoà	UBND phường 5	số 347 Lạc Long Quân, phường 5, quận 11	UBND phường 5 số 347 Lạc Long Quân, phường 5, quận 11 	10.7703634	106.6445325			  			
Hoà Hiệp	71	Xã	25995	99.28	261.83	Xã Hoà Hiệp (H. Xuyên Mộc) (giữ nguyên)		xã Bàu Lâm, xã Hoà Hội, xã Bình Châu và tỉnh Lâm Đồng	UBND xã Hoà Hiệp	tỉnh lộ 329, ấp Phú Bình, xã Hòa Hiệp, huyện Xuyên Mộc	UBND xã Hoà Hiệp tỉnh lộ 329, ấp Phú Bình, xã Hòa Hiệp, huyện Xuyên Mộc 	10.6891167	107.5004804			  			
Hoà Hội	72	Xã	36174	136.27	265.46	Xã Hoà Hội, Xã Hoà Hưng, Xã Hoà Bình (H. Xuyên Mộc)		xã Bàu Lâm, xã Xuân Sơn, xã Hồ Tràm, xã Xuyên Mộc, xã Bình Châu và xã Hoà Hiệp	UBND xã Hoà Bình	ấp 4, xã Hòa Bình, huyện Xuyên Mộc	UBND xã Hoà Bình ấp 4, xã Hòa Bình, huyện Xuyên Mộc 	10.6267998	107.3721556			  			
Hoà Hưng	73	Phường	96414	2.59	37225.48	Phường 12 (Quận 10), Phường 13 (Quận 10), Phường 15 (Quận 10)	Phường 14 (Quận 10)	phường Diên Hồng, phường Vườn Lài, phường Nhiêu Lộc, phường Xuân Hoà và phường Tân Hoà	Trụ sở Khối vận & Đoàn thể quận 10	số nhà TT20 Tam Đảo, phường 15, quận 10	Trụ sở Khối vận & Đoàn thể quận 10 số nhà TT20 Tam Đảo, phường 15, quận 10 	10.7798101	106.6638084			  			
Hoà Lợi	74	Phường	79694	33.59	2372.58	Phường Tân Định (TP. Bến Cát), Phường Hoà Lợi (TP. Bến Cát)		phường Vĩnh Tân, phường Bình Dương, phường Thới Hoà, phường Phú An, phường Chánh Hiệp và phường Chánh Phú Hoà	UBND phường Hòa Lợi	đường ĐTT 741, khu phố An Hòa, phường Hòa Lợi, TP. Bến Cát	UBND phường Hòa Lợi đường ĐTT 741, khu phố An Hòa, phường Hòa Lợi, TP. Bến Cát 	11.1015568	106.6631442			  			
Hóc Môn	75	Xã	93323	16.43	5680.04	Xã Tân Xuân (H. Hóc Môn), Xã Tân Hiệp (H. Hóc Môn), Thị trấn Hóc Môn (H. Hóc Môn)		xã Đông Thạnh, xã Xuân Thới Sơn, xã Bà Điểm, xã Củ Chi, xã Phú Hoà Đông, xã Bình Mỹ	Liên đoàn lao động huyện Hóc Môn	số 11 Lý Thường Kiệt, thị trấn Hóc Môn, huyện Hóc Môn	Liên đoàn lao động huyện Hóc Môn số 11 Lý Thường Kiệt, thị trấn Hóc Môn, huyện Hóc Môn 	10.884384	106.5874506			  			
Hưng Long	76	Xã	71504	35.54	2012.21	Xã Hưng Long (H. Bình Chánh), Xã Qui Đức (H. Bình Chánh), Xã Đa Phước (H. Bình Chánh)		xã Bình Chánh, xã Bình Hưng, xã Hiệp Phước và tỉnh Tây Ninh	UBND xã Hưng Long	số 564 Đoàn Nguyễn Tuấn, xã Hưng Long	UBND xã Hưng Long số 564 Đoàn Nguyễn Tuấn, xã Hưng Long 	10.6502447	106.6245691	UBND xã Qui Đức	B3/24 ấp 2, xã Qui Đức, huyện Bình Chánh	UBND xã Qui Đức B3/24 ấp 2, xã Qui Đức, huyện Bình Chánh 	10.6484657	106.6496856	
Khánh Hội	77	Phường	94507	1.07	88324.3	Phường 8 (Quận 4), Phường 9 (Quận 4)	Phường 2 (Quận 4), Phường 4 (Quận 4), Phường 15 (Quận 4)	phường Xóm Chiếu, phường Vĩnh Hội và phường Tân Hưng, phường Bến Thành, phường Cầu Ông Lãnh	Trung tâm Chính Trị Quận 4	số 85 - 87 Tân Vĩnh, phường 9, quận 4	Trung tâm Chính Trị Quận 4 số 85 - 87 Tân Vĩnh, phường 9, quận 4 	10.7596319	106.7000834			  			
Kim Long	78	Xã	33369	63.92	522.04	Thị trấn Kim Long, Xã Bàu Chinh, Xã Láng Lớn (H. Châu Đức)		xã Bình Giã, xã Châu Đức, phường Tân Thành và xã Ngãi Giao	UBND Thị trấn Kim Long	quốc lộ 56, thị trấn Kim Long, huyện Châu Đức	UBND Thị trấn Kim Long quốc lộ 56, thị trấn Kim Long, huyện Châu Đức 	10.702368	107.2440953			  			
Lái Thiêu	79	Phường	118852	15.46	7687.71	Phường Lái Thiêu (TP. Thuận An), Phường Bình Nhâm (TP. Thuận An)	Phường Vĩnh Phú (TP. Thuận An)	phường Bình Hoà, phường Thuận An, phường Thuận Giao, phường An Phú Đông và xã Đông Thạnh	UBND TP Thuận An	trụ sở ở khu phố chợ, phường Lái Thiêu, TP.Thuận An	UBND TP Thuận An trụ sở ở khu phố chợ, phường Lái Thiêu, TP.Thuận An 	10.9033669	106.7002909			  			
Linh Xuân	80	Phường	158334	12.29	12883.16	Phường Linh Trung (TP. Thủ Đức), Phường Linh Xuân (TP. Thủ Đức)	Phường Linh Tây (TP. Thủ Đức)	phường Thủ Đức, phường Hiệp Bình, phường Tam Bình, phường Tăng Nhơn Phú, phường Long Bình và phường Dĩ An, phường Đông Hoà	UBND phường Linh Xuân	số 81 Hoàng Cầm (quốc lộ 1K cũ), phường Linh Xuân, TP.Thủ Đức	UBND phường Linh Xuân số 81 Hoàng Cầm (quốc lộ 1K cũ), phường Linh Xuân, TP.Thủ Đức 	10.8784602	106.7664314			  			
Long Bình	81	Phường	119637	29.43	4065.14	Phường Long Bình (TP. Thủ Đức)	Phường Long Thạnh Mỹ (TP. Thủ Đức)	phường Tăng Nhơn Phú, phường Linh Xuân, phường Long Phước, phường Đông Hoà và tỉnh Đồng Nai	UBND phường Long Thạnh Mỹ	số 325 Nguyễn Văn Tăng, phường Long Thạnh Mỹ, TP.Thủ Đức	UBND phường Long Thạnh Mỹ số 325 Nguyễn Văn Tăng, phường Long Thạnh Mỹ, TP.Thủ Đức 	10.8418744	106.8237487			  			
Long Điền	82	Xã	48048	51.44	934.06	Thị trấn Long Điền, Xã Tam An (H. Long Đất)		phường Bà Rịa, phường Tam Long, phường Phước Thắng, xã Đất Đỏ, xã Phước Hải và xã Long Hải	UBND huyện Long Điền	số 1939, quốc lộ 55, thị trấn Long Điền, huyện Long Đất	UBND huyện Long Điền số 1939, quốc lộ 55, thị trấn Long Điền, huyện Long Đất 	10.4785109	107.2160292			  			
Long Hải	83	Xã	109149	27.93	3907.95	Thị trấn Long Hải, Xã Phước Tỉnh, Xã Phước Hưng (H. Long Đất)		phường Phước Thắng, xã Long Điền, xã Phước Hải và Biển Đông	UBND Thị trấn Long Hải	đường Hùng Vương, thị trấn Long Hải, huyện Long Đất	UBND Thị trấn Long Hải đường Hùng Vương, thị trấn Long Hải, huyện Long Đất 	10.4041001	107.2301996			  			
Long Hoà	84	Xã	25215	166.76	151.21	Xã Long Tân (H. Dầu Tiếng), Xã Long Hoà (H. Dầu Tiếng)	Xã Minh Tân (H. Dầu Tiếng), Xã Minh Thạnh (H. Dầu Tiếng)	xã Trừ Văn Thố, xã Bàu Bàng, xã Dầu Tiếng, xã Thanh An, xã Minh Thạnh, phường Long Nguyên và tỉnh Đồng Nai	UBND xã Long Hòa	đường DT749, xã Long Hoà, huyện Dầu Tiếng	UBND xã Long Hòa đường DT749, xã Long Hoà, huyện Dầu Tiếng 	11.3145054	106.4918309			  			
Long Hương	85	Phường	31457	41.22	763.15	Phường Kim Dinh (TP. Bà Rịa), Phường Long Hương (TP. Bà Rịa), Xã Tân Hưng (TP. Bà Rịa)		phường Bà Rịa, phường Tam Long, phường Tân Hải, phường Phước Thắng, xã Long Sơn, xã Châu Pha và xã Nghĩa Thành	UBND Phường Kim Dinh	đường Trịnh Đình Thảo, khu phố Kim Sơn, phường Kim Dinh, TP.Bà Rịa	UBND Phường Kim Dinh đường Trịnh Đình Thảo, khu phố Kim Sơn, phường Kim Dinh, TP.Bà Rịa 	10.4992113	107.1307289			  			
Long Nguyên	86	Phường	53387	108	494.32	Xã Long Nguyên (H. Bàu Bàng), Phường An Điền (TP. Bến Cát)	Phường Mỹ Phước (TP. Bến Cát)	phường Bến Cát, phường Thới Hoà, phường Tây Nam, phường Phú An, xã Long Hoà, xã Bàu Bàng và xã Thanh An	UBND phường An Điền	đường Hùng Vương, phường An Điền, TP.Bến Cát	UBND phường An Điền đường Hùng Vương, phường An Điền, TP.Bến Cát 	11.1478979	106.5594687			  			
Long Phước	87	Phường	53092	34.29	1548.32	Phường Long Phước (TP. Thủ Đức), Phường Trường Thạnh (TP. Thủ Đức)		phường Long Bình, phường Long Trường, phường Tăng Nhơn Phú và tỉnh Đồng Nai	UBND phường Long Phước	số 239 khu phố Long Thuận, phường Long Phước, TP.Thủ Đức	UBND phường Long Phước số 239 khu phố Long Thuận, phường Long Phước, TP.Thủ Đức 	10.80931	106.8595997			  			
Long Sơn	88	Xã	17767	56.5	314.46	Xã Long Sơn (TP. Vũng Tàu) (giữ nguyên)		phường Phước Thắng, phường Long Hương, phường Tân Hải và Biển Đông	UBND xã Long Sơn	thôn 1, xã Long Sơn, TP.Vũng Tàu	UBND xã Long Sơn thôn 1, xã Long Sơn, TP.Vũng Tàu 	10.4636855	107.0842161			  			
Long Trường	89	Phường	73669	24.49	3008.13	Phường Long Trường (TP. Thủ Đức), Phường Phú Hữu (TP. Thủ Đức)		phường Long Phước, phường Bình Trưng, phường Cát Lái, phường Tăng Nhơn Phú, phường Phước Long và tỉnh Đồng Nai	UBND phường Long Trường	số 1341 Nguyễn Duy Trinh, phường Long Trường, TP.Thủ Đức	UBND phường Long Trường số 1341 Nguyễn Duy Trinh, phường Long Trường, TP.Thủ Đức 	10.8053765	106.8166739			  			
Minh Phụng	90	Phường	90808	1.27	71502.36	Phường 1 (Quận 11), Phường 7 (Quận 11), Phường 16 (Quận 11)		phường Bình Thới, phường Phú Thọ, phường Chợ Lớn, phường Bình Tây, phường Phú Lâm, phường Diên Hồng	UBND phường 7	số 183A Lý Nam Đế, phường 7, quận 11	UBND phường 7 số 183A Lý Nam Đế, phường 7, quận 11 	10.7593705	106.6613602			  			
Minh Thạnh	91	Xã	24215	159.06	152.24	Xã Minh Hoà (H. Dầu Tiếng)	Xã Minh Tân (H. Dầu Tiếng), Xã Minh Thạnh (H. Dầu Tiếng)	xã Long Hoà, xã Dầu Tiếng, tỉnh Đồng Nai và tỉnh Tây Ninh	UBND xã Minh Hòa	ấp 3, xã Minh hòa, huyện Dầu Tiếng	UBND xã Minh Hòa ấp 3, xã Minh hòa, huyện Dầu Tiếng 	11.4468432	106.4835457			  			
Ngãi Giao	92	Xã	49065	69.3	708.01	Thị trấn Ngãi Giao, Xã Bình Ba, Xã Suối Nghệ (H. Châu Đức)		xã Bình Giã, xã Kim Long, phường Tân Thành, xã Châu Pha và xã Nghĩa Thành	UBND huyện Châu Đức	số 70 Trần Hưng Đạo, thị trấn Ngãi Giao, huyện Châu Đức	UBND huyện Châu Đức số 70 Trần Hưng Đạo, thị trấn Ngãi Giao, huyện Châu Đức 	10.6552529	107.243237			  			
Nghĩa Thành	93	Xã	27819	65.67	423.63	Xã Đá Bạc (H. Châu Đức), Xã Nghĩa Thành (H. Châu Đức)		phường Long Hương, phường Tam Long, xã Đất Đỏ, xã Xuân Sơn, xã Bình Giã, xã Ngãi Giao và xã Châu Pha	UBND Xã Nghĩa Thành	tổ 6, thôn Sông Cầu, xã Nghĩa Thành, huyện Châu Đức	UBND Xã Nghĩa Thành tổ 6, thôn Sông Cầu, xã Nghĩa Thành, huyện Châu Đức 	10.5677597	107.211463			  			
Nhà Bè	94	Xã	125832	37.1	3391.7	Thị trấn Nhà Bè, Xã Phú Xuân, Xã Phước Kiển, Xã Phước Lộc (H. Nhà Bè)		xã Hiệp Phước, phường Phú Thuận, phường Tân Hưng, phường Tân Mỹ, xã Bình Hưng và tỉnh Đồng Nai	UBND huyện Nhà Bè	số 330 Nguyễn Bình, xã Phú Xuân, huyện Nhà Bè	UBND huyện Nhà Bè số 330 Nguyễn Bình, xã Phú Xuân, huyện Nhà Bè 	10.6743896	106.732963			  			
Nhiêu Lộc	95	Phường	88090	1.71	51514.62	Phường 9 (Quận 3), Phường 11 (Quận 3), Phường 12 (Quận 3), Phường 14 (Quận 3)		phường Xuân Hoà, phường Phú Nhuận, phường Tân Sơn Nhất, phường Vườn Lài, phường Hoà Hưng	UBND phường 9	số 82 Bà Huyện Thanh Quan, phường 9, quận 3	UBND phường 9 số 82 Bà Huyện Thanh Quan, phường 9, quận 3 	10.7815668	106.6821972			  			
Nhuận Đức	96	Xã	40239	62.06	648.4	Xã Nhuận Đức (H. Củ Chi), Xã Trung Lập Hạ (H. Củ Chi), Xã Phạm Văn Cội (H. Củ Chi)		xã Thái Mỹ, xã Tân An Hội, xã Củ Chi, xã Phú Hoà Đông, xã An Nhơn Tây và phường Tây Nam	UBND xã Nhuận Đức	ấp Ngã 4, xã Nhuận Đức, huyện Củ Chi	UBND xã Nhuận Đức ấp Ngã 4, xã Nhuận Đức, huyện Củ Chi 	11.0340967	106.4870629			  			
Phú An	97	Phường	46142	34.97	1319.47	Xã Phú An (TP. Bến Cát), Phường Tân An (TP. Thủ Dầu Một)	Phường Hiệp An (TP. Thủ Dầu Một)	phường Chánh Hiệp, phường Hoà Lợi, phường Thới Hoà, phường Long Nguyên, phường Tây Nam, xã Phú Hoà Đông và xã Bình Mỹ	UBND phường Hiệp An	số 143 Nguyễn Đức Cảnh, phường Hiệp An, TP.Thủ Dầu Một	UBND phường Hiệp An số 143 Nguyễn Đức Cảnh, phường Hiệp An, TP.Thủ Dầu Một 	11.0268507	106.638019			  			
Phú Định	98	Phường	150389	5.85	25707.52	Phường Xóm Củi (Quận 8), Phường 14 (Quận 8), Phường 15 (Quận 8)	Phường 16 (Quận 8)	phường Bình Đông, phường Bình Tiên, phường Bình Phú, phường Chánh Hưng, phường An Đông, phường Chợ Lớn, phường An Lạc và xã Tân Nhựt	UBND phường 16	số 450 Phú Định, phường 16, quận 8	UBND phường 16 số 450 Phú Định, phường 16, quận 8 	10.7119933	106.6235052	UBND phường 15	số 184 Lưu Hữu Phước, phường 15, quận 8	UBND phường 15 số 184 Lưu Hữu Phước, phường 15, quận 8 	10.7140522	106.6266761	
Phú Giáo	99	Xã	42739	192.83	221.64	Xã An Bình (H. Phú Giáo), Thị trấn Phước Vĩnh (H. Phú Giáo)	Xã Tam Lập (H. Phú Giáo)	xã Phước Thành, xã Phước Hoà, xã Bắc Tân Uyên và tỉnh Đồng Nai	UBND huyện Phú Giáo	đường Hùng Vương, khu Phố 2, huyện Phú Giáo	UBND huyện Phú Giáo đường Hùng Vương, khu Phố 2, huyện Phú Giáo 	11.2948527	106.7953959			  			
Phú Hoà Đông	100	Xã	97766	59.75	1636.25	Xã Tân Thạnh Tây (H. Củ Chi), Xã Tân Thạnh Đông (H. Củ Chi), Xã Phú Hoà Đông (H. Củ Chi)		xã Bình Mỹ, xã Củ Chi, xã Nhuận Đức, xã Xuân Thới Sơn, phường Tây Nam và phường Phú An	UBND xã Tân Thạnh Tây	số 269 tỉnh lộ 8, xã Tân Thạnh Tây, huyện Củ Chi	UBND xã Tân Thạnh Tây số 269 tỉnh lộ 8, xã Tân Thạnh Tây, huyện Củ Chi 	10.9848881	106.5593469			  			
Phú Lâm	101	Phường	87513	2	43756.5	Phường 12 (Quận 6), Phường 13 (Quận 6), Phường 14 (Quận 6)		phường Bình Tiên, phường Bình Phú và phường Bình Tây, phường An Lạc, phường Bình Trị Đông, phường Phú Thạnh, phường Tân Phú, phường Minh Phụng, phường Bình Thới	Quận đoàn quận 6	số 15 Chợ Lớn, phường 11, quận 6	Quận đoàn quận 6 số 15 Chợ Lớn, phường 11, quận 6 	10.745922	106.6340882			  			
Phú Lợi	102	Phường	107721	17.96	5997.83	Phường Phú Lợi (TP. Thủ Dầu Một), Phường Phú Hoà (TP. Thủ Dầu Một)	Phường Hiệp Thành (TP. Thủ Dầu Một)	phường Tân Khánh, phường Thuận Giao, phường Thủ Dầu Một, phường Chánh Hiệp, phường Thuận An và phường Bình Dương	UBND phường Phú Hòa	số 438 đường Phú Lợi, phường Phú Hoà, TP.Thủ Dầu Một	UBND phường Phú Hòa số 438 đường Phú Lợi, phường Phú Hoà, TP.Thủ Dầu Một 	10.9842866	106.6812449			  			
Phú Mỹ	103	Phường	78641	70.92	1108.87	Phường Mỹ Xuân (TP. Phú Mỹ), Phường Phú Mỹ (TP. Phú Mỹ)		phường Tân Thành, phường Tân Phước, xã Châu Pha, xã Thạnh An và tỉnh Đồng Nai	UBND TP Phú Mỹ	số 412 Độc Lập, phường Phú Mỹ, TP.Phú Mỹ	UBND TP Phú Mỹ số 412 Độc Lập, phường Phú Mỹ, TP.Phú Mỹ 	10.5905345	107.0480378			  			
Phú Nhuận	104	Phường	68420	1.46	46863.01	Phường 8 (Quận Phú Nhuận), Phường 10 (Quận Phú Nhuận), Phường 11 (Quận Phú Nhuận), Phường 13 (Quận Phú Nhuận)	Phường 15 (Quận Phú Nhuận)	phường Đức Nhuận, phường Cầu Kiệu, phường Nhiêu Lộc, phường Xuân Hoà, phường Tân Sơn Hoà	UBND quận Phú Nhuận	số 159 Nguyễn Văn Trỗi, phường 11, quận Phú Nhuận	UBND quận Phú Nhuận số 159 Nguyễn Văn Trỗi, phường 11, quận Phú Nhuận 	10.7951947	106.6752532			  			
Phú Thạnh	105	Phường	103780	2.99	34709.03	Phường Phú Thạnh (Quận Tân Phú), Phường Hiệp Tân (Quận Tân Phú)	Phường Tân Thới Hoà (Quận Tân Phú)	phường Phú Thọ Hoà, phường Tân Phú, phường Phú Lâm, phường Bình Trị Đông, phường Bình Hưng Hoà	UBND phường Phú Thạnh	số 275 Nguyễn Sơn, phường Phú Thạnh, quận Tân Phú.	UBND phường Phú Thạnh số 275 Nguyễn Sơn, phường Phú Thạnh, quận Tân Phú. 	10.783329	106.6242735			  			
