Vĩnh Hội	159	Phường	63015	1.17	53858.97	Phường 1 (Quận 4), Phường 3 (Quận 4)	Phường 2 (Quận 4), Phường 4 (Quận 4)	phường Khánh Hội, phường Cầu Ông Lãnh, phường Chợ Quán, phường Chánh Hưng, phường Tân Hưng	Nhà thiếu nhi Quận 4	số 405 Hoàng Diệu, phường 2, quận 4	Nhà thiếu nhi Quận 4 số 405 Hoàng Diệu, phường 2, quận 4 	10.759179	106.6980305			  			
Vĩnh Lộc	160	Xã	167521	30.55	5483.5	Xã Vĩnh Lộc A (H. Bình Chánh)	Xã Phạm Văn Hai (H. Bình Chánh)	xã Tân Vĩnh Lộc, phường Bình Tân, xã Bà Điểm, xã Xuân Thới Sơn và tỉnh Tây Ninh	UBND xã Vĩnh Lộc A	số F7/16 Vĩnh Lộc, xã Vĩnh Lộc A, huyện Bình Chánh	UBND xã Vĩnh Lộc A số F7/16 Vĩnh Lộc, xã Vĩnh Lộc A, huyện Bình Chánh 	10.81346	106.5786221			  			
Vĩnh Tân	161	Phường	61865	61.35	1008.39	Thị trấn Tân Bình (H. Bắc Tân Uyên), Phường Vĩnh Tân (TP. Tân Uyên)		phường Bình Cơ, phường Chánh Phú Hoà, phường Hoà Lợi, phường Bình Dương, phường Tân Hiệp và xã Phước Hoà	UBND phường Vĩnh Tân	đường 742, phường Vĩnh Tân, TP.Tân Uyên	UBND phường Vĩnh Tân đường 742, phường Vĩnh Tân, TP.Tân Uyên 	11.1156601	106.7060936			  			
Vũng Tàu	162	Phường	117413	16.86	6963.99	Phường 1 (TP. Vũng Tàu), Phường 2 (TP. Vũng Tàu), Phường 3 (TP. Vũng Tàu), Phường 4 (TP. Vũng Tàu), Phường 5 (TP. Vũng Tàu), Phường Thắng Nhì (TP. Vũng Tàu), Phường Thắng Tam (TP. Vũng Tàu)		phường Tam Thắng và Biển Đông	UBND TP Vũng Tàu	số 89 Lý Thường Kiệt, phường 1, TP.Vũng Tàu	UBND TP Vũng Tàu số 89 Lý Thường Kiệt, phường 1, TP.Vũng Tàu 	10.3502593	107.0762912			  			
Vườn Lài	163	Phường	104076	1.28	81309.38	Phường 1 (Quận 10), Phường 2 (Quận 10), Phường 4 (Quận 10), Phường 9 (Quận 10), Phường 10 (Quận 10)		phường Diên Hồng, phường Hoà Hưng, phường Bàn Cờ, phường Chợ Quán và phường An Đông	UBND phường 4	số 410 - 412 Ngô Gia Tự, phường 4, quận 10	UBND phường 4 số 410 - 412 Ngô Gia Tự, phường 4, quận 10 	10.76155	106.669813			  			
Xóm Chiếu	164	Phường	57875	1.94	29832.47	Phường 13 (Quận 4), Phường 16 (Quận 4), Phường 18 (Quận 4)	Phường 15 (Quận 4)	phường Khánh Hội, phường Tân Thuận, phường Sài Gòn, phường Bến Thành và phường An Khánh	UBND quận 4	số 18 Đoàn Như Hài, phường 13, quận 4	UBND quận 4 số 18 Đoàn Như Hài, phường 13, quận 4 	10.7663304	106.7051269			  			
Xuân Hoà	165	Phường	48464	2.22	21830.63	Phường Võ Thị Sáu (Quận 3)	Phường 4 (Quận 3)	phường Nhiêu Lộc, phường Bàn Cờ, phường Tân Định, phường Sài Gòn, phường Vườn Lài, phường Phú Nhuận	UBND quận 3	số 99 - 99A Trần Quốc Thảo, phường Võ Thị Sáu, quận 3	UBND quận 3 số 99 - 99A Trần Quốc Thảo, phường Võ Thị Sáu, quận 3 	10.7828058	106.6861435			  			
Xuân Sơn	166	Xã	27368	73.81	370.79	Xã Suối Rao (H. Châu Đức), Xã Xuân Sơn (H. Châu Đức), Xã Sơn Bình (H. Châu Đức)		xã Bình Giã, xã Nghĩa Thành, xã Đất Đỏ, xã Hồ Tràm, xã Hoà Hội và xã Bàu Lâm	UBND Xã Xuân Sơn	tổ 10, thôn Xuân Tân, xã Xuân Sơn, huyện Châu Đức	UBND Xã Xuân Sơn tổ 10, thôn Xuân Tân, xã Xuân Sơn, huyện Châu Đức 	10.6470359	107.3291263			  			
Xuân Thới Sơn	167	Xã	103643	35.21	2943.57	Xã Xuân Thới Đông (H. Hóc Môn), Xã Xuân Thới Sơn (H. Hóc Môn), Xã Tân Thới Nhì (H. Hóc Môn)		xã Hóc Môn, xã Bà Điểm, xã Củ Chi và tỉnh Tây Ninh	UBND xã Xuân Thới Sơn	số 1A Lê Thị Kim, ấp 3, xã Xuân Thới Sơn, huyện Hóc Môn	UBND xã Xuân Thới Sơn số 1A Lê Thị Kim, ấp 3, xã Xuân Thới Sơn, huyện Hóc Môn 	10.8746712	106.5842113			  			
Xuyên Mộc	168	Xã	26917	102.96	261.43	Xã Bông Trang, Xã Xuyên Mộc, Xã Bưng Riềng (H. Xuyên Mộc)		xã Bình Châu, xã Hoà Hội, xã Hồ Tràm và Biển Đông	UBND Xã Bông Trang	quốc lộ 55, ấp Trang Hoàng, xã Bông Trang, huyện Xuyên Mộc	UBND Xã Bông Trang quốc lộ 55, ấp Trang Hoàng, xã Bông Trang, huyện Xuyên Mộc 	10.5532506	107.4554749			  			